{
	"name": "Friedrich ten Hagen",
	"company": "Advertace",
	"when": {
		"friday": true,
		"saturday": true
	},
	"iCanTakeNotesDuringSessions": false,
	"tags": ["React", "Html", "CSS", "vanilla js"],
	"vegan": false,
	"vegetarian": true,
	"allergies": ["none"],
	"whatIsMyConnectionToJavascript": "I have been studying web dev for a year and am now getting to know React.",
	"whatCanIContribute": "Enthusiasm. Also happy to help where needed.",
	"tShirt": {
		"size": "M",
		"type": "regular"
	}
}
