{
	"name": "Martin Grandrath",
	"company": "codecentric AG",
	"when": {
		"friday": true,
		"saturday": true
	},
	"iCanTakeNotesDuringSessions": false,
	"tags": ["Agile", "TDD", "Architecture"],
	"vegan": false,
	"vegetarian": false,
	"whatIsMyConnectionToJavascript": "I'm a JS developer for over 12 years. It became my primary programming language :-)",
	"whatCanIContribute": "I like to share the 'Testing without Mocks' pattern by James Shore",
	"tShirt": {
		"size": "L",
		"type": "regular"
	}
}
