{
	"name": "Ana Carraca",
	"company": "Maze",
	"when": {
		"friday": true,
		"saturday": true
	},
	"iCanTakeNotesDuringSessions": true,
	"tags": ["React", "NestJS", "GraphQL", "Next.js"],
	"vegan": false,
	"vegetarian": true,
	"whatIsMyConnectionToJavascript": "I've been working with JS/TS for a while, looking forward to learn new things",
	"whatCanIContribute": "Can talk about observability/monitoring and how to add authorization to an existing product",
	"tShirt": {
		"size": "M",
		"type": "fitted"
	},
	"twitter": "ACarraca"
}
