{
    "name": "Alex Mu√±oz",
    "company": "eXXcellent solutions GmbH",
    "when": {
        "friday": true,
        "saturday": true
    },
    "iCanTakeNotesDuringSessions": false,
    "tags": ["JavaScript", "TypeScript", "React"],
    "whatIsMyConnectionToJavascript": "I use Js/Ts in my daily job",
    "whatCanIContribute": "Exchange of knowledge, ideas and experiences around Web Development.",
    "tShirt": {
        "size": "S",
        "type": "regular"
    }
}
