{
	"name": "Monica Mikhael",
	"company": "FINN",
	"when": {
		"friday": true,
		"saturday": false
	},
	"iCanTakeNotesDuringSessions": false,
	"tags": ["Typescript", "React", "Next.js", "Node"],
	"vegan": false,
	"vegetarian": false,
	"whatIsMyConnectionToJavascript": "I've been working with JS/TS every day at work, looking forward to learn new things",
	"whatCanIContribute": "I am not good at talks, but I can share my experience in React and JS/TS in general",
	"tShirt": {
		"size": "L",
		"type": "fitted"
	}
}
