{
	"name": "Larisa Dolgova",
	"company": "Futurice",
	"when": {
		"friday": true,
		"saturday": true
	},
	"iCanTakeNotesDuringSessions": false,
	"tags": ["TypeScript", "React", "GraphQL", "Python"],
	"vegan": false,
	"vegetarian": false,
	"whatIsMyConnectionToJavascript": "I work with JS on a daily basis",
	"whatCanIContribute": "Participate in discussions",
	"tShirt": {
		"size": "S",
		"type": "regular"
	}
}
