{
	"name": "Vanderlei Alves da Silva",
	"company": "Regiondo GmbH",
	"when": {
		"friday": true,
		"saturday": true
	},
	"iCanTakeNotesDuringSessions": true,
	"tags": ["Clean Code", "Clean Architecture", "ECMAScript", "Node", "typescript"],
	"vegan": false,
	"vegetarian": false,
	"whatIsMyConnectionToJavascript": "working",
	"whatCanIContribute": "Sharing knowledge around Microfrontend topics, web component development, Javascript and Typescript",
	"tShirt": {
		"size": "S",
		"type": "regular"
	}
}