{
    "name": "Dmitrii Forofontov",
    "when": {
        "friday": true,
        "saturday": true
    },
    "iCanTakeNotesDuringSessions": true,
    "tags": ["Next", "TS", "Clean Code", "Microservices"],
    "vegan": false,
    "vegetarian": false,
    "whatIsMyConnectionToJavascript": "Working with JS for 2.5 years, mostly on the fullstack side.",
    "whatCanIContribute": "How Typescript makes code harder to read and maintain and how to avoid it.",
    "tShirt": {
        "size": "L",
        "type": "regular"
    }
}